imdb_title_id,title,original_title,year,date_published,genre,duration,country,language,director,writer,production_company,actors,description,avg_vote,votes,budget,usa_gross_income,worlwide_gross_income,metascore,reviews_from_users,reviews_from_critics
tt0317648,Oceano di fuoco - Hidalgo,Hidalgo,2004,2004-04-09,"Action, Adventure, Biography",136,"USA, Morocco","English, Arabic, Sioux",Joe Johnston,John Fusco,Touchstone Pictures,"Viggo Mortensen, Zuleikha Robinson, Omar Sharif, Louise Lombard, Adam Alexi-Malle, Saïd Taghmaoui, Silas Carson, Harsh Nayyar, J.K. Simmons, Adoni Maropis, Victor Talmadge, Peter Mensah, Joshua Wolf Coleman, Franky Mwangi, Floyd 'Red Crow' Westerman","In 1890, a down-and-out cowboy and his horse travel to Arabia to compete in a deadly cross desert horse race.",6.7,76379,"$100,000,000","$67,303,450","$108,040,622",54,354,144
tt2799166,La Piramide,The Pyramid,2014,2015-02-18,"Action, Adventure, Horror",89,"USA, Morocco",English,Grégory Levasseur,"Daniel Meersand, Nick Simon",Twentieth Century Fox,"Ashley Hinshaw, Denis O'Hare, James Buckley, Christa Nicola, Amir K, Faycal Attougui, Philip Shelley, Ait Hamou Amine, Omar Benbrahim, Joseph Beddelem, Chakir El Faaiz",An archaeological team attempts to unlock the secrets of a lost pyramid only to find themselves hunted by an insidious creature.,4.6,22741,"$6,500,000","$2,756,333","$16,861,137",24,136,118
tt0763840,Home of the Brave - Eroi senza gloria,Home of the Brave,2006,2007-03-01,"Action, Drama, War",106,"USA, Morocco","English, Spanish, Arabic",Irwin Winkler,"Mark Friedman, Mark Friedman",Metro-Goldwyn-Mayer (MGM),"Samuel L. Jackson, Jessica Biel, Brian Presley, 50 Cent, Christina Ricci, Chad Michael Murray, Victoria Rowell, Jeffrey Nordling, Vyto Ruginis, Sam Jones III, James MacDonald, Sandra Nelson, Jack Serino, Brendan Wayne, Mohamed Zinathlah",Three soldiers struggle to readjust to life at home after returning home from a lengthy tour in Iraq.,5.6,10379,"$12,000,000","$51,708","$499,620",42,93,68
tt1837636,Queen of the Desert,Queen of the Desert,2015,2017-04-14,"Adventure, Biography, Drama",128,"USA, Morocco","English, Arabic, Turkish, French",Werner Herzog,Werner Herzog,Benaroya Pictures,"Nicole Kidman, James Franco, Robert Pattinson, Damian Lewis, Jay Abdo, Jenny Agutter, David Calder, Christopher Fulford, Nick Waring, Holly Earl, Mark Lewis Jones, Beth Goddard, Michael Jenn, William Ellis, John Wark","A chronicle of Gertrude Bell's life, a traveler, writer, archaeologist, explorer, cartographer, and political attaché for the British Empire at the dawn of the twentieth century.",5.7,9827,"$15,000,000",,"$1,592,853",39,97,137
tt0962711,The Objective,The Objective,2008,2008-04-24,"Horror, Sci-Fi, Thriller",90,"USA, Morocco","English, Pushto",Daniel Myrick,"Daniel Myrick, Mark A. Patton",Jaz Films,"Jonas Ball, Matthew R. Anderson, Jon Huertas, Michael C. Williams, Sam Hunter, Jeff Prewett, Kenny Taylor, Chems-Eddine Zinoune, Qzaibar Allal, Hammou Abaou, Rkia Chkaroll, Ibtihal Iataren, El Hayrani Lekbir, P. David Miller, Vanessa Johansson","A military special operations team, led by a CIA case officer, are on a mission in the harsh and hostile terrain of Afghanistan where they find themselves in a Middle Eastern ""Bermuda Triangle"" of ancient evil.",5.5,7744,"$4,000,000",$95,$95,26,68,39
tt4949290,Killing Salazar,Cartels,2017,2017-07-07,"Action, Crime, Mystery",95,"USA, Monaco, Romania",English,Keoni Waxman,"Keoni Waxman, Richard Beattie",Daro Film Distribution,"Steven Seagal, Luke Goss, Georges St-Pierre, Darren E. Scott, Florin Piersic Jr., Martine Argent, Lauro David Chartrand-DelValle, Bruce Crawford, Claudiu Bleont, Howard Dell, George Remes, Adina Galupa, Sharlene Royer, Bogdan Farcas, Massimo Dobrovic","A drug lord is captured and held ""secretly"" by 6 US agents at a hotel in Constanta, Romania. He agreed to testify against others in the drug business. They send lots of armed men to the hotel. Lots of shooting follows.",3.8,1403,"$6,000,000",,"$37,766",,22,14
tt0119485,Kundun,Kundun,1997,1998-03-26,"Biography, Drama, History",134,"USA, Monaco, Morocco","English, Tibetan, Mandarin",Martin Scorsese,Melissa Mathison,De Fina-Cappa,"Tenzin Thuthob Tsarong, Gyurme Tethong, Tulku Jamyang Kunga Tenzin, Tenzin Yeshi Paichang, Tencho Gyalpo, Tenzin Topjar, Tsewang Migyur Khangsar, Tenzin Lodoe, Geshi Yeshi Gyatso, Losang Gyatso, Sonam Phuntsok, Gyatso Lukhang, Lobsang Samten, Jigme Tsarong, Tenzin Trinley","From childhood to adulthood, Tibet's fourteenth Dalai Lama deals with Chinese oppression and other problems.",7,25870,"$28,000,000","$5,684,789","$5,684,789",74,131,76
tt5470222,Contract to Kill,Contract to Kill,2016,2016-12-09,"Action, Adventure, Thriller",90,"USA, Monaco",English,Keoni Waxman,Keoni Waxman,Daro Film Distribution,"Steven Seagal, Russell Wong, Jemma Dallender, Mircea Drambareanu, Sergiu Costache, Ghassan Bouz, Camillo Aviles, Toma Danila, Andrei Stanciu, Salex Iatma, Omar Aziz Jassim, Radu Andrei Micu, Oana Mosneagu, Ioachim Ciobanu, Sorin Godi",Islamic extremists will make an alliance with a Mexican cartel to smuggle WMD and terrorists into USA. Harmon's asked to prevent this. He starts in Istanbul with his team.,3.4,1459,"$5,000,000",,"$7,048",3,36,21
tt1621046,Cesar Chavez,Cesar Chavez,2014,2014-03-28,"Biography, Drama",102,"USA, Mexico, United Arab Emirates","English, Spanish",Diego Luna,"Timothy J. Sexton, Keir Pearson",Canana Films,"Kerry Ardra, Maynor Alvarado, Yancey Arias, Wes Bentley, Sara Banerjee, Liv Boughn, Darion Basco, Lisa Brenner, Duncan Bridgeman, Aldo Ceceña, Michael Cudlitz, Roger Cudney, Rosario Dawson, America Ferrera, Rodolfo Figueroa",A biography of the civil-rights activist and labor organizer,6.4,3168,"$10,000,000","$5,571,497","$6,972,226",51,32,49
tt0484740,L'amore ai tempi del colera,Love in the Time of Cholera,2007,2007-12-21,"Drama, Romance",139,"USA, Mexico, UK",English,Mike Newell,"Ronald Harwood, Gabriel García Márquez",New Line Cinema,"Benjamin Bratt, Gina Bernard Forbes, Giovanna Mezzogiorno, Javier Bardem, Marcela Mar, Juan Ángel, Liliana Gonzalez, Catalina Botero, Miguel Angel Pazos Galindo, Maria Cecilia Herrera, Luis Fernando Hoyos, Carlos Duplat, Francisco Raul Linero, Unax Ugalde, Liev Schreiber","Florentino, rejected by the beautiful Fermina at a young age, devotes much of his adult life to carnal affairs as a desperate attempt to heal his broken heart.",6.4,22246,"$45,000,000","$4,607,608","$31,575,877",43,122,120
tt0377744,Un giorno senza messicani,A Day Without a Mexican,2004,2004-05-21,"Comedy, Drama, Fantasy",100,"USA, Mexico, Spain","English, Spanish",Sergio Arau,"Sergio Arau, Yareli Arizmendi",Eye On The Ball Films,"Caroline Aaron, Tony Abatemarco, Melinda Allen, Frankie J. Allison, Fernando Arau, Yareli Arizmendi, Todd Babcock, Maria Beck, Yeniffer Behrens, Arell Blanton, Cassidy Paige Bringas, Brian Brophy, Pilar Camporredondo, Elpidia Carrillo, Larry Carroll","When a mysterious fog surrounds the boundaries of California, there is a communication breakdown and all the Mexicans disappear, affecting the economy and the state stops working missing the Mexican workers and dwellers.",4.7,3019,"$1,500,000","$4,179,890","$10,057,021",30,95,22
tt1098327,Dragonball Evolution,Dragonball Evolution,2009,2009-04-10,"Action, Adventure, Family",85,"USA, Mexico, Japan, Hong Kong, UK","English, Japanese, Hindi",James Wong,"Ben Ramsey, Akira Toriyama",Twentieth Century Fox,"Justin Chatwin, Yun-Fat Chow, Emmy Rossum, Jamie Chung, James Marsters, Joon Park, Eriko Tamura, Randall Duk Kim, Ernie Hudson, Texas Battle, Megumi Seki, Ian Whyte, Richard Blake, Jon Valera, Rafael Valdez","The young warrior Son Goku sets out on a quest, racing against time and the vengeful King Piccolo, to collect a set of seven magical orbs that will grant their wielder unlimited power.",2.5,69279,"$30,000,000","$9,362,785","$55,720,772",45,584,140
tt3397884,Sicario,Sicario,2015,2015-09-24,"Action, Crime, Drama",121,"USA, Mexico, Hong Kong","English, Spanish",Denis Villeneuve,Taylor Sheridan,Lionsgate,"Emily Blunt, Benicio Del Toro, Josh Brolin, Victor Garber, Jon Bernthal, Daniel Kaluuya, Jeffrey Donovan, Raoul Max Trujillo, Julio Cesar Cedillo, Hank Rogerson, Bernardo Saracino, Maximiliano Hernández, Kevin Wiggins, Edgar Arreola, Kim Larrichio",An idealistic FBI agent is enlisted by a government task force to aid in the escalating war against drugs at the border area between the U.S. and Mexico.,7.6,360616,"$30,000,000","$46,889,293","$84,872,444",82,729,545
tt0120746,La maschera di Zorro,The Mask of Zorro,1998,1998-12-18,"Action, Adventure, Comedy",136,"USA, Mexico, Germany",English,Martin Campbell,"Johnston McCulley, Ted Elliott",TriStar Pictures,"José María de Tavira, Diego Sieres, Emiliano Guerra, Yolanda Orizaga, Paco Morayta, William Marquez, Stuart Wilson, Tony Amendola, Anthony Hopkins, Pedro Altamirano, Luisa Huertas, María Fernández Cruz, Mónica Fernández Cruz, Julieta Rosen, Antonio Banderas","A young thief, seeking revenge for the death of his brother, is trained by the once great, but aged Zorro, who also pursues vengeance of his own.",6.7,166238,"$95,000,000","$94,095,523","$250,288,523",63,349,139
tt0181865,Traffic,Traffic,2000,2001-03-09,"Crime, Drama, Thriller",147,"USA, Mexico, Germany","English, Spanish",Steven Soderbergh,"Simon Moore, Stephen Gaghan",Compulsion Inc.,"Benicio Del Toro, Jacob Vargas, Andrew Chavez, Michael Saucedo, Tomas Milian, Jose Yenque, Emilio Rivera, Michael O'Neill, Michael Douglas, Russell G. Jones, Lorene Hetherington, Eric Collins, Beau Holden, Peter Stader, James Lew","A conservative judge is appointed by the President to spearhead America's escalating war against drugs, only to discover that his teenage daughter is a crack addict. Two DEA agents protect an informant. A jailed drug baron's wife attempts to carry on the family business.",7.6,193193,"$48,000,000","$124,115,725","$207,515,725",86,897,201
tt0450345,Il prescelto,The Wicker Man,2006,2006-11-17,"Horror, Mystery, Thriller",102,"USA, Mexico, Canada, Germany",English,Neil LaBute,"Neil LaBute, Anthony Shaffer",Warner Bros.,"Nicolas Cage, Ellen Burstyn, Kate Beahan, Frances Conroy, Molly Parker, Leelee Sobieski, Diane Delano, Michael Wiseman, Erika-Shaye Gair, Christa Campbell, Emily Holmes, Zemphira Gosling, Matthew Walker, Mary Black, Christine Willes","A sheriff investigating the disappearance of a young girl from a small island discovers there's a larger mystery to solve among the island's secretive, neo-pagan community.",3.7,63349,"$40,000,000","$23,649,127","$38,805,380",36,781,199
tt1535108,Elysium,Elysium,2013,2013-08-29,"Action, Drama, Sci-Fi",109,"USA, Mexico, Canada","English, Spanish, French, Afrikaans, Ukrainian",Neill Blomkamp,Neill Blomkamp,TriStar Pictures,"Matt Damon, Jodie Foster, Sharlto Copley, Alice Braga, Diego Luna, Wagner Moura, William Fichtner, Brandon Auret, Josh Blacker, Emma Tremblay, Jose Pablo Cantillo, Maxwell Perry Cotton, Faran Tahir, Adrian Holmes, Jared Keeso","In the year 2154, the very wealthy live on a man-made space station while the rest of the population resides on a ruined Earth. A man takes on a mission that could bring equality to the polarized worlds.",6.6,413841,"$115,000,000","$93,050,117","$286,140,700",61,920,503
tt0113617,L'ultimo cacciatore,Last of the Dogmen,1995,1995-09-08,"Adventure, Western",118,"USA, Mexico, Canada",English,Tab Murphy,Tab Murphy,Carolco Pictures,"Tom Berenger, Barbara Hershey, Kurtwood Smith, Steve Reevis, Andrew Miller, Gregory Scott Cummins, Mark Boone Junior, Helen Calahasen, Eugene Blackbear, Dawn Lavand, Sidel Standing Elk, Hunter Bodine, Graham Jarvis, Parley Baer, Sherwood Price",A Montana bounty hunter and an anthropologist discover a tribe of Native Americans living in a settlement isolated from the rest of the world.,7,4826,,"$7,024,389","$7,024,389",,93,16
tt0156020,Ricky 6,Ricky 6,2000,2000-07-01,"Biography, Crime, Drama",111,"USA, Mexico, Canada",English,Peter Filardi,Peter Filardi,Image Group Entertainment,"Vincent Kartheiser, Chad Christ, Sabine Singh, Richard M. Stuart, Patrick Renna, Emmanuelle Chriqui, Kett Turton, Joshua Dov, Charlene Fernetz, Stephen Morgan, Darcy Allan, Hillary Allan, Donald Ray 'Speedy' Caldwell Jr., John Lister, Dean Butler","Based on the true story of drugs, satanism, and murder in the upper class town of Northport, Long Island in 1984.",6,597,,,,,10,2
tt0117509,Romeo + Giulietta di William Shakespeare,Romeo + Juliet,1996,1997-02-28,"Drama, Romance",120,"USA, Mexico, Australia, Canada",English,Baz Luhrmann,"William Shakespeare, Craig Pearce",Bazmark Films,"Leonardo DiCaprio, Claire Danes, John Leguizamo, Harold Perrineau, Lupita Ochoa, Pete Postlethwaite, Gloria Silva, Paul Sorvino, Brian Dennehy, Paul Rudd, Vondie Curtis-Hall, Carolyn Valero, Miriam Margolyes, Paco Morayta, Jesse Bradford",Shakespeare's famous play is updated to the hip modern suburb of Verona still retaining its original dialogue.,6.7,206404,"$14,500,000","$46,351,345","$151,842,560",60,579,103
tt0120338,Titanic,Titanic,1997,1998-01-16,"Drama, Romance",194,"USA, Mexico, Australia, Canada","English, Swedish, Italian, French",James Cameron,James Cameron,Twentieth Century Fox,"Leonardo DiCaprio, Kate Winslet, Billy Zane, Kathy Bates, Frances Fisher, Gloria Stuart, Bill Paxton, Bernard Hill, David Warner, Victor Garber, Jonathan Hyde, Suzy Amis, Lewis Abernathy, Nicholas Cascone, Anatoly M. Sagalevitch","A seventeen-year-old aristocrat falls in love with a kind but poor artist aboard the luxurious, ill-fated R.M.S. Titanic.",7.8,1023181,"$200,000,000","$659,363,944","$2,195,169,869",75,2884,331
tt7547410,Dora e la città perduta,Dora and the Lost City of Gold,2019,2019-09-26,"Adventure, Comedy, Family",102,"USA, Mexico, Australia","English, Spanish, Quechua",James Bobin,"Nicholas Stoller, Matthew Robinson",Paramount Players,"Benicio Del Toro, Madelyn Miranda, Dee Bradley Baker, Malachi Barton, Sasha Toro, Marc Weiner, Eva Longoria, Michael Peña, Joey Vieira, Pia Miller, Isabela Merced, Jeff Wahlberg, Adriana Barraza, Damien Garvey, Anikka Abelita","Dora, a teenage explorer, leads her friends on an adventure to save her parents and solve the mystery behind a lost city of gold.",6.1,21413,"$49,000,000","$60,477,943","$119,682,635",63,276,131
tt1068641,The Burning Plain - Il confine della solitudine,The Burning Plain,2008,2008-11-07,"Crime, Drama, Romance",107,"USA, Mexico, Argentina","English, Spanish",Guillermo Arriaga,Guillermo Arriaga,2929 Productions,"Charlize Theron, John Corbett, José María Yazpik, Robin Tunney, Gray Eubank, Fernanda Romero, Kacie Thomas, Martin Papazian, Sean McGrath, JD Pardo, Diego J. Torres, José Gallardo Jr., Rachel Ticotin, Rosalia De Aragon, Debrianna Mansini",A drama with a two-tiered storyline concerning a mother and daughter who try to form a bond after the young woman's difficult childhood.,6.8,18436,"$20,000,000","$200,730","$5,642,478",45,56,129
tt1077258,Planet Terror,Planet Terror,2007,2007-09-28,"Action, Adventure, Comedy",105,"USA, Mexico",English,Robert Rodriguez,Robert Rodriguez,Dimension Films,"Rose McGowan, Freddy Rodríguez, Josh Brolin, Marley Shelton, Jeff Fahey, Michael Biehn, Rebel Rodriguez, Bruce Willis, Naveen Andrews, Julio Oscar Mechoso, Fergie, Nicky Katt, Hung Nguyen, Cecilia Conti, Tommy Nix","After an experimental bio-weapon is released, turning thousands into zombie-like creatures, it's up to a rag-tag group of survivors to stop the infected and those behind its release.",7.1,197514,,,"$11,446,172",,279,178
tt5052474,Soldado,Sicario: Day of the Soldado,2018,2018-10-18,"Action, Adventure, Crime",122,"USA, Mexico","English, Spanish, American Sign Language, Arabic, Somali",Stefano Sollima,Taylor Sheridan,Columbia Pictures,"Benicio Del Toro, Josh Brolin, Isabela Merced, Jeffrey Donovan, Catherine Keener, Manuel Garcia-Rulfo, Matthew Modine, Shea Whigham, Elijah Rodriguez, Howard Ferguson Jr., David Castañeda, Jacqueline Torres, Raoul Max Trujillo, Bruno Bichir, Jake Picking","The drug war on the U.S.-Mexico border has escalated as the cartels have begun trafficking terrorists across the US border. To fight the war, federal agent Matt Graver re-teams with the mercurial Alejandro.",7.1,119798,"$35,000,000","$50,072,235","$75,837,743",61,672,305
tt0193560,Texas Rangers,Texas Rangers,2001,2002-07-12,"Action, Adventure, Drama",90,"USA, Mexico",English,Steve Miner,"George Durham, Scott Busby",Greisman Productions,"James Van Der Beek, Rachael Leigh Cook, Ashton Kutcher, Dylan McDermott, Usher Raymond, Tom Skerritt, Randy Travis, Leonor Varela, Brian Martell, Alfred Molina, Billy Morton, Kate Newby, Robert Patrick, Gordon Michaels, Joe Renteria","A ragtag group of youngsters band together after the American Civil War to form the Texas Rangers, a group charged with the dangerous, ruthless duty of cleaning up the West.",5.2,5392,"$38,000,000","$623,374","$763,740",29,73,31
tt0758730,Aliens vs. Predator 2,AVPR: Aliens vs Predator - Requiem,2007,2008-01-25,"Action, Adventure, Fantasy",94,"USA, Mexico",English,"Colin Strause, Greg Strause","Shane Salerno, Dan O'Bannon",Twentieth Century Fox,"Steven Pasquale, Reiko Aylesworth, John Ortiz, Johnny Lewis, Ariel Gade, Kristen Hager, Sam Trammell, Robert Joy, David Paetkau, Tom Woodruff Jr., Ian Whyte, Chelah Horsdal, Meshach Peters, Matt Ward, Michal Suchánek","Warring Alien and Predator races descend on a rural Colorado town, where unsuspecting residents must band together for any chance of survival.",4.7,114294,"$40,000,000","$41,797,066","$130,290,885",29,1070,228
tt0386140,The Legend of Zorro,The Legend of Zorro,2005,2005-10-28,"Action, Adventure, Romance",129,"USA, Mexico","English, Spanish",Martin Campbell,"Roberto Orci, Alex Kurtzman",Columbia Pictures,"Alberto Reyes, Julio Oscar Mechoso, Gustavo Sánchez Parra, Adrian Alonso, Nick Chinlund, Giovanna Zacarías, Carlos Cobos, Antonio Banderas, Michael Emerson, Shuler Hensley, Pedro Armendáriz Jr., Mary Crosby, Catherine Zeta-Jones, Mauricio Bonet, Fernando Becerril","Despite trying to keep his swashbuckling to a minimum, a threat to California's pending statehood causes the adventure-loving Don Alejandro de la Vega and his wife, Elena, to take action.",6,91465,"$75,000,000","$46,464,023","$142,400,065",47,255,132
tt0149261,Blu profondo,Deep Blue Sea,1999,1999-11-19,"Action, Adventure, Sci-Fi",105,"USA, Mexico","English, Spanish",Renny Harlin,"Duncan Kennedy, Donna Powers",Warner Bros.,"Thomas Jane, Saffron Burrows, Samuel L. Jackson, Jacqueline McKenzie, Michael Rapaport, Stellan Skarsgård, LL Cool J, Aida Turturro, Cristos, Daniel Rey, Valente Rodriguez, Brent Roam, Eyal Podell, Erinn Bartlett, Dan Thiel","Searching for a cure to Alzheimer's disease, a group of scientists on an isolated research facility become the prey, as a trio of intelligent sharks fight back.",5.9,122850,"$60,000,000","$73,648,142","$164,648,142",54,694,192
tt0109959,Gunmen - Banditi,Gunmen,1993,1993-09-03,"Action, Comedy, Crime",94,"USA, Mexico",English,Deran Sarafian,Stephen Sommers,Davis Entertainment,"Christopher Lambert, Mario Van Peebles, Denis Leary, Patrick Stewart, Kadeem Hardison, Sally Kirkland, Richard C. Sarafian, Robert Harper, Brenda Bakke, James Chalke, Humberto Elizondo, Andaluz Russell, Tamara Shanath, Deran Sarafian, Christopher Michael","USD400,000,000 is stolen and a drug lord wants it back. The killed thief's brother is broken out of prison by a DEA bounty hunter to help find the money boat. The body count continues in Latin America.",5.3,3251,"$8,030,000","$3,411,885","$3,411,885",,27,24
tt1502397,Bad Boys for Life,Bad Boys for Life,2020,2020-02-20,"Action, Comedy, Crime",124,"USA, Mexico","English, Spanish","Adil El Arbi, Bilall Fallah","Peter Craig, Joe Carnahan",Columbia Pictures,"Will Smith, Martin Lawrence, Vanessa Hudgens, Alexander Ludwig, Charles Melton, Paola Nuñez, Kate del Castillo, Nicky Jam, Joe Pantoliano, Jacob Scipio, Theresa Randle, DJ Khaled, Happy Anderson, Bianca Bethune, Dennis Greene",Miami detectives Mike Lowrey and Marcus Burnett must face off against a mother-and-son pair of drug lords who wreak vengeful havoc on their city.,6.6,111557,"$90,000,000","$204,417,855","$424,617,855",59,1072,238
tt0107219,Uno sporco affare di droga,Inside Edge,1992,1993-11-02,"Action, Crime",84,"USA, Mexico",English,"Warren Clarke, William Tannen",Vincent Gutierrez,,"Michael Madsen, Richard Lynch, Rosie Vela, Conrad Dunn, Tony Peck, Branscombe Richmond, Clifford Dalton, D. Paul Thomas, Jorge Alberto, Kevin Beter, Mark Blaha, Brenda Careaga, Kelly Dearen, Dorian Drake Jr., David Espinity","Loose cannon Sgt. Richard Montana screws up a major drug bust and is passed over for promotion for Henderson, a cop he holds responsible for the death of his first partner. Disgusted, ...",4.2,121,,,,,4,2
tt0100485,Revenge - Vendetta,Revenge,1990,1990-08-31,"Action, Crime, Drama",124,"USA, Mexico","English, Spanish",Tony Scott,"Jim Harrison, Jim Harrison",New World Pictures,"Kevin Costner, Anthony Quinn, Madeleine Stowe, Tomas Milian, Joaquín Martínez, James Gammon, Jesse Corti, Sally Kirkland, Luis de Icaza, Gerardo Zepeda, Miguel Ferrer, John Leguizamo, Joe Santos, Christofer de Oni, Daniel Rojo","A retired US Navy pilot comes to Mexico, where he falls in love with the wife of a powerful businessman. The consequences will be cruel and unforeseen.",6.3,16303,,"$15,645,616","$15,645,616",35,88,33
tt0109444,Sotto il segno del pericolo,Clear and Present Danger,1994,1994-12-07,"Action, Crime, Drama",141,"USA, Mexico",English,Phillip Noyce,"Tom Clancy, Donald E. Stewart",Mace Neufeld Productions,"Harrison Ford, Willem Dafoe, Anne Archer, Joaquim de Almeida, Henry Czerny, Harris Yulin, Donald Moffat, Miguel Sandoval, Benjamin Bratt, Raymond Cruz, Dean Jones, Thora Birch, Ann Magnuson, Hope Lange, Tom Tammi",CIA Analyst Jack Ryan is drawn into an illegal war fought by the US government against a Colombian drug cartel.,6.9,87565,"$62,000,000","$122,187,717","$215,887,717",74,151,54
tt0139487,Naked Lies,Naked Lies,1998,1998-08-25,"Action, Crime, Drama",93,"USA, Mexico",English,Ralph E. Portillo,"D. Alvelo, Jalee Bailey",Hemisferio Films,"Shannon Tweed, Fernando Allende, Jay Baker, Steven Bauer, Salvador Pineda, Michael Rose, Hugo Stiglitz, Mineko Mori, Jaqueline Fernandez, Gerardo Samaripa, Eliezer Zaldaña, Gerardo Valdivia, Enrique Flores, Ricarda Edelsbacher, Juan Andrés Bueno","FBI agent Cara Landry is sent on an undercover assignment to gather evidence on Damian Medina, a Mexican casino owner running a counterfeiting operation for the Cali drug cartel. With ...",3.1,312,,,,,4,2
tt0443274,Prospettive di un delitto,Vantage Point,2008,2008-02-29,"Action, Crime, Drama",90,"USA, Mexico","English, Spanish",Pete Travis,Barry L. Levy,Columbia Pictures,"Dennis Quaid, Matthew Fox, Forest Whitaker, Bruce McGill, Edgar Ramírez, Saïd Taghmaoui, Ayelet Zurer, Zoe Saldana, Sigourney Weaver, William Hurt, James Le Gros, Eduardo Noriega, Richard T. Jones, Holt McCallany, Leonardo Nam",The attempted assassination of the American President is told and re-told from several different perspectives.,6.6,143518,"$40,000,000","$72,266,306","$152,039,882",40,451,231
tt1567609,Viaggio in paradiso,Get the Gringo,2012,2012-06-01,"Action, Crime, Drama",96,"USA, Mexico","English, Spanish",Adrian Grunberg,"Mel Gibson, Stacy Perskie",Icon Productions,"Mel Gibson, Kevin Balmore, Daniel Giménez Cacho, Jesús Ochoa, Dolores Heredia, Peter Gerety, Roberto Sosa, Peter Stormare, Mario Zaragoza, Gerardo Taracena, Dean Norris, Tenoch Huerta, Fernando Becerril, Scott Cohen, Bob Gunton",A career criminal nabbed by Mexican authorities is placed in a tough prison where he learns to survive with the help of a young boy.,7,102076,"$20,000,000",,"$8,826,837",60,157,210
tt3268668,Captive,Captive,2015,2015-09-18,"Action, Crime, Drama",97,"USA, Mexico",English,Jerry Jameson,"Brian Bird, Ashley Smith",BN Films,"Elle Graham, Kate Mara, Claudia Church, Gina Stewart, David Oyelowo, Diva Tyler, E. Roger Mitchell, Richard Fullerton, Michael Kenneth Williams, Jessica Oyelowo, Leonor Varela, Michael Harding, Matt Lowe, Sydelle Noel, Mimi Rogers",A single mother struggling with drug addiction is taken hostage in her own apartment by a man on the run who has broken out of jail and murdered the judge assigned to his case.,5.4,6360,"$2,000,000","$2,583,301","$2,801,508",36,30,47
tt0116367,Dal tramonto all'alba,From Dusk Till Dawn,1996,1997-01-03,"Action, Crime, Horror",108,"USA, Mexico","English, Spanish",Robert Rodriguez,"Robert Kurtzman, Quentin Tarantino",Dimension Films,"George Clooney, Quentin Tarantino, Harvey Keitel, Juliette Lewis, Ernest Liu, Salma Hayek, Cheech Marin, Danny Trejo, Tom Savini, Fred Williamson, Michael Parks, Brenda Hillhouse, John Saxon, Marc Lawrence, Kelly Preston","Two criminals and their hostages unknowingly seek temporary refuge in a truck stop populated by vampires, with chaotic results.",7.2,281205,"$19,000,000","$25,836,616","$25,836,616",48,667,197
tt0112851,Desperado,Desperado,1995,1996-02-09,"Action, Crime, Thriller",104,"USA, Mexico","English, Spanish",Robert Rodriguez,Robert Rodriguez,Columbia Pictures,"Antonio Banderas, Salma Hayek, Joaquim de Almeida, Cheech Marin, Steve Buscemi, Carlos Gómez, Quentin Tarantino, Tito Larriva, Angel Aviles, Danny Trejo, Abraham Verduzco, Carlos Gallardo, Albert Michel Jr., David Alvarado, Angela Lanza",Former musician and gunslinger El Mariachi arrives at a small Mexican border town after being away for a long time. His past quickly catches up with him and he soon gets entangled with the local drug kingpin Bucho and his gang.,7.2,168748,"$7,000,000","$25,405,445","$25,405,445",55,213,108
