imdb_title_id,title,original_title,year,date_published,genre,duration,country,language,director,writer,production_company,actors,description,avg_vote,votes,budget,usa_gross_income,worlwide_gross_income,metascore,reviews_from_users,reviews_from_critics
tt1213648,London Boulevard,London Boulevard,2010,2011-06-10,"Crime, Drama",103,"USA, UK",English,William Monahan,"William Monahan, Ken Bruen",GK Films,"Colin Farrell, Keira Knightley, David Thewlis, Anna Friel, Ben Chaplin, Ray Winstone, Eddie Marsan, Sanjeev Bhaskar, Stephen Graham, Ophelia Lovibond, Jamie Campbell Bower, Velibor Topic, Lee Boardman, Alan Williams, Jonathan Cullen",An ex-con with a reputation tries to go straight by working as a handy man for a reclusive actress but this is unfortunately not the wish of London's underground crime lord.,6.2,46085,"$25,000,000","$16,075","$8,307,227",52,118,125
tt0113044,Festa di luglio,Feast of July,1995,1995-10-13,"Crime, Drama, Mystery",116,"USA, UK",English,Christopher Menaul,"H.E. Bates, Christopher Neame",Touchstone Pictures,"Embeth Davidtz, Tom Bell, Gemma Jones, James Purefoy, Ben Chaplin, Kenneth Anderson, Greg Wise, David Neal, Julian Protheroe, Mark Neal, Tim Preece, Daphne Neville, Charles De'Ath, Colin Prockter, Richard Hope","After an abandoned young woman in late 19th Century England is taken in by a rural couple with three handsome sons, tragic consequences result.",6.1,491,,"$293,274","$293,274",,8,14
tt0385705,The Football Factory,The Football Factory,2004,2004-05-14,"Crime, Drama, Sport",91,"USA, UK",English,Nick Love,"John King, Nick Love",Vertigo Films,"Danny Dyer, Frank Harper, Tamer Hassan, Roland Manookian, Neil Maskell, Dudley Sutton, Jamie Foreman, Tony Denham, Calum MacNab, John Junkin, Sophie Linfield, Kara Tointon, Michele Hallak, Daniel Naylor, Alison Egan","An insight on the gritty life of a bored male, Chelsea football hooligan who lives for violence, sex, drugs & alcohol.",6.8,28289,,,"$1,228,003",,117,44
tt0100442,Terzo grado,Q & A,1990,1990-04-27,"Crime, Drama, Thriller",132,"USA, UK","English, Spanish",Sidney Lumet,"Edwin Torres, Sidney Lumet",Regency International Pictures,"Nick Nolte, Timothy Hutton, Armand Assante, Patrick O'Neal, Lee Richardson, Luis Guzmán, Charles S. Dutton, Jenny Lumet, Paul Calderon, International Chrysis, Dominic Chianese, Leonardo Cimino, Fyvush Finkel, Gustavo Brens, Martin E. Brens","When dirty cop Mike shoots a man and plants a gun on him, rookie assistant DA Al gets the case. Something in the Q&A of Mike isn't right. Bodies pile up as Al tries to solve the case.",6.6,5190,,"$11,207,891","$11,207,891",,46,42
tt0115710,Blood and Wine,Blood and Wine,1996,1997-01-30,"Crime, Drama, Thriller",101,"USA, UK",English,Bob Rafelson,"Nick Villiers, Bob Rafelson",Recorded Picture Company (RPC),"Jack Nicholson, Stephen Dorff, Jennifer Lopez, Judy Davis, Michael Caine, Harold Perrineau, Robyn Peterson, Mike Starr, John Seitz, Marc Macaulay, Dan Daily, Marta Velasco, Thom Christopher, Mario Ernesto Sánchez, John Hackett","A man who has failed as a father and husband commits a heist to make money for his fledging business, but things become complicated when his wife interferes.",6,9046,"$22,000,000","$1,094,668","$1,094,668",,61,47
tt0116282,Fargo,Fargo,1996,1996-05-16,"Crime, Drama, Thriller",98,"USA, UK",English,"Joel Coen, Ethan Coen","Ethan Coen, Joel Coen",PolyGram Filmed Entertainment,"William H. Macy, Steve Buscemi, Peter Stormare, Kristin Rudrüd, Harve Presnell, Tony Denman, Gary Houston, Sally Wingert, Kurt Schweickhardt, Larissa Kokernot, Melissa Peterman, Steve Reevis, Warren Keith, Steve Edelman, Sharon Anderson",Jerry Lundegaard's inept crime falls apart due to his and his henchmen's bungling and the persistent police work of the quite pregnant Marge Gunderson.,8.1,600952,"$7,000,000","$24,611,975","$60,611,975",85,960,227
tt0117194,Libertà vigilata,No Way Home,1996,1997-05-23,"Crime, Drama, Thriller",99,"USA, UK",English,Buddy Giovinazzo,Buddy Giovinazzo,Orenda Films,"Tim Roth, James Russo, Deborah Kara Unger, Joseph Ragno, Catherine Kellner, Saul Stein, Bernadette Penotti, Gareth Williams, Jerry Dean, Larry Romano, Mike Grief, Michael Cambridge, James Starace, James Shue, Heather Gottlieb",An ex-cons future is threatened by his brother's involvement with drugs.,6.8,1323,"$4,000,000",,,,15,11
tt0116762,Keys to Tulsa,Keys to Tulsa,1997,1997-04-11,"Crime, Drama, Thriller",113,"USA, UK",English,Leslie Greif,"Brian Fair Berkey, Harley Peyton",Empire Pictures,"Eric Stoltz, James Spader, Deborah Kara Unger, Joanna Going, Michael Rooker, Randy Graff, Mary Tyler Moore, James Coburn, Peter Strauss, Cameron Diaz, Dennis Letts, Josh Ridgway, Marco Perella, George Greif, Doran Ingram","Richter is a lazy son of a wealthy woman, who's put up with too much so no more money. He's about to lose his local newspaper job arranged by his mom. Richter owes money to a violent drug dealer/blackmailer but sees his wife. Death wish?",5.2,1550,,"$57,252","$57,252",,22,14
tt0398017,Derailed - Attrazione letale,Derailed,2005,2006-01-13,"Crime, Drama, Thriller",108,"USA, UK","English, French",Mikael Håfström,"Stuart Beattie, James Siegel",Di Bonaventura Pictures,"Vincent Cassel, Clive Owen, Addison Timlin, Melissa George, Jennifer Aniston, Sandra Bee, RZA, William Armstrong, Tom Conti, Rachael Blake, Richard Leaf, Xzibit, Catherine McCord, Denis O'Hare, Georgina Chapman","When two married business executives having an affair are blackmailed by a violent criminal, the two must turn the tables on him to save their families.",6.6,70124,"$22,000,000","$36,024,076","$57,479,076",40,391,116
tt1038915,Shoot on Sight,Shoot on Sight,2007,2008-08-22,"Crime, Drama, Thriller",110,"USA, UK","English, Hindi, Urdu",Jag Mundhra,"Carl Austin, Jag Mundhra",Aron Govil Productions,"Naseeruddin Shah, Greta Scacchi, Brian Cox, Stephen Greif, Om Puri, Gulshan Grover, Chris Wilson, Sadie Frost, Mikaal Zulfiqar, Laila Rouass, India Wadsworth, Arrun Harker, Tolga Safer, Clifford Samuel, San Shella",A Lahore-born London Police Commander deals with personal issues and investigates the shooting death of a fellow-Muslim.,6.1,1604,GBP 3950000,,"$264,617",45,11,14
tt1440728,The American,The American,2010,2010-09-10,"Crime, Drama, Thriller",105,"USA, UK","English, Italian",Anton Corbijn,"Rowan Joffe, Martin Booth",Focus Features,"George Clooney, Irina Björklund, Lars Hjelm, Björn Granath, Johan Leysen, Paolo Bonacelli, Giorgio Gobbi, Silvana Bosi, Thekla Reuten, Guido Palliggiano, Samuel Vauramo, Antonio Rampino, Violante Placido, Filippo Timi, Ilaria Cramerotti",An assassin hides out in Italy for one last assignment.,6.3,90601,"$20,000,000","$35,606,376","$67,876,281",61,527,345
tt1718763,Desiree,Desiree,2014,2016-09-27,"Crime, Drama, Thriller",93,"USA, UK",English,Ross Clarke,"Ross Clarke, Ross Clarke",Keep The Car Running,"Joseph Morgan, Nicole Badaan, Walton Goggins, Lucius Falick, Ron Perlman, Anwan Glover, Kate Walsh, Major Dodson, Lawrence Turner, Dana Gourrier, Persia White, Felicia Pearson, Christopher Berry, Sarah Ellis Smith, Jeff Pope","An inspired experimental chemist, wakes up in a New Orleans jail, accused of arson that's linked to an illegal drug-manufacturing ring. Suffering from amnesia, he's unexpectedly released on bail, determined to find his missing girlfriend.",5,170,,,,,,1
tt0475989,Nailed,Nailed,2006,2006,"Crime, Horror, Thriller",90,"USA, UK",English,Adrian O'Connell,Stephen McAnena,Ben Katz Productions,"Charles Porter, Wilson Jermaine Heredia, Sam Sarpong, Veronica Borchi, George LePorte, Samantha Mumba, Ray Stoney, Marshal Hilton, Marcel Donea, Henry Maguire, Bashir Salahuddin, Chase Polan, Rory Zacher, Pat Casey, Steve Shaheen","""Nailed"" is a thriller about two men who break into a house in attempt to escape arrest by police, and find instead a man lying on a bed, covered in bandages, whose caretaker may have ...",4.1,485,"$250,000",,,,7,6
tt1502407,Halloween,Halloween,2018,2018-10-25,"Crime, Horror, Thriller",106,"USA, UK",English,David Gordon Green,"John Carpenter, Debra Hill",Blumhouse Productions,"Jamie Lee Curtis, Judy Greer, Andi Matichak, James Jude Courtney, Nick Castle, Haluk Bilginer, Will Patton, Rhian Rees, Jefferson Hall, Toby Huss, Virginia Gardner, Dylan Arnold, Miles Robbins, Drew Scheid, Jibrail Nantambu","Laurie Strode confronts her long-time foe Michael Myers, the masked figure who has haunted her since she narrowly escaped his killing spree on Halloween night four decades ago.",6.6,112488,"$10,000,000","$159,342,015","$255,485,178",67,1760,486
tt0364045,Identità violate,Taking Lives,2004,2004-04-30,"Crime, Mystery, Thriller",103,"USA, UK","English, French",D.J. Caruso,"Michael Pye, Jon Bokenkamp",Warner Bros.,"Angelina Jolie, Ethan Hawke, Kiefer Sutherland, Gena Rowlands, Olivier Martinez, Tchéky Karyo, Jean-Hugues Anglade, Paul Dano, Justin Chatwin, André Lacoste, Billy Two Rivers, Richard Lemire, Julien Poulin, Marie-Josée Croze, Christian Tessier",An FBI profiler is called in by French Canadian police to catch a serial killer who takes on the identity of each new victim.,6.3,78956,"$45,000,000","$32,682,342","$65,470,529",38,337,146
tt0103253,Whore (Puttana),Whore,1991,1991-06-21,Drama,85,"USA, UK",English,Ken Russell,"David Hines, Ken Russell",Cheap Date,"Theresa Russell, Benjamin Mouton, Antonio Fargas, Elizabeth Morehead, Daniel Quinn, Sanjay Chandani, Jason Saucier, Michael Crabtree, Jered Barclay, Doug MacHugh, Amanda Goodwin, Frank Smith, Jason Kristofer, Robert O'Reilly, Ginger Lynn","The prostitute Liz works on the streets of Los Angeles. She recalls her life in flashback, when she marries an alcoholic man. She leaves him with their son. Then she works as waitress in a ...",5.6,3409,,"$1,008,404","$1,008,404",,32,31
tt0119845,"Other Voices, Other Rooms","Other Voices, Other Rooms",1995,1997-12-05,Drama,94,"USA, UK",English,David Rocksavage,"Truman Capote, Sara Flanigan",Golden Eye Films,"Lothaire Bluteau, Anna Thomson, David Speck, April Turner, Frank Hoyt Taylor, Leonard Watkins, Aubrey Dollar, Liz Byler, Moses Gibson, Terri Dollar, Jayne Morgan, Brian Moeller, Lonnie Hamilton, Yamilet Hidalgo, Wayne Caparas","Other Voices, Other Rooms",6.3,168,,,,,6,7
tt0117165,Never Ever,Never Ever,1996,1997-09-17,Drama,110,"USA, UK","English, French",Charles Finch,Charles Finch,Trimark Pictures,"Sandrine Bonnaire, Jane March, Charles Finch, James Fox, Jean Rochefort, Julian Sands, Patrick Le Barz, Marc Estrada, Gillian Clarck","Thomas Murray and Amanda have just moved to Paris. He works for a bank owned by Amanda's father Arthur Trevane. Amanda decides that she does not like Paris, so she goes back to London. ...",4.5,122,,,,,3,
tt0126859,La perdita dell'innocenza,The Loss of Sexual Innocence,1999,1999-11-26,Drama,106,"USA, UK",English,Mike Figgis,Mike Figgis,Newmarket Capital Group,"Julian Sands, Saffron Burrows, Stefano Dionisi, Kelly Macdonald, Gina McKee, Jonathan Rhys Meyers, Bernard Hill, Rossy de Palma, John Cowey, Nina McKay, Dickson Osa-Omorogbe, Jock Gibson Cowl, Justin Chadwick, Femi Ogunbanjo, Hanne Klintoe","Non-linear film tells the sexual story of a film director from his life at age 5, 12 and 16, a man embarking on his first film in 1950s Tunisia, and finally to his current life. Along the ...",5.4,3053,"$4,000,000","$164,022","$164,022",42,70,30
tt0189744,Miss Julie,Miss Julie,1999,2000-05-19,Drama,103,"USA, UK",English,Mike Figgis,"Helen Cooper, August Strindberg",Moonstone Entertainment,"Saffron Burrows, Peter Mullan, Maria Doyle Kennedy, Tam Dean Burn, Heathcote Williams, Eileen Walsh, Sue Maund, Joanna Page, Andrea Ollson, Sara Li Gustafsson, Bill Ellis, Duncan MacAskill, Katie Cohen, Helen Cooper, Flora Bradwell",A footman seduces a count's daughter.,6.2,1435,,"$43,941","$43,941",46,37,28
tt0328538,Thirteen - 13 anni,Thirteen,2003,2003-11-21,Drama,100,"USA, UK","English, Spanish, Portuguese",Catherine Hardwicke,"Catherine Hardwicke, Nikki Reed",Fox Searchlight Pictures,"Nikki Reed, Evan Rachel Wood, Vanessa Hudgens, Holly Hunter, Brady Corbet, Ulysses Estrada, Sarah Blakley-Cartwright, Jenicka Carey, Sarah Clarke, Jasmine Di Angelo, Tessa Ludwick, Kip Pardue, Cece Tsou, Jeremy Sisto, Jamison Yang","A thirteen-year-old girl's relationship with her mother is put to the test as she discovers drugs, sex, and petty crime in the company of her cool but troubled best friend.",6.8,78564,"$2,000,000","$4,601,043","$10,128,960",70,550,130
tt0368725,The Fever,The Fever,2004,2004-09-24,Drama,83,"USA, UK",English,Carlo Gabriel Nero,"Carlo Gabriel Nero, Wallace Shawn",HBO Films,"Vanessa Redgrave, Cameron D'Angelo, Kiera D'Angelo, Geraldine James, Angelina Jolie, Daria Knez, Kika Markham, Michael Moore, Joely Richardson, Rade Serbedzija, Miriam Turner",Tells the story of a woman who gets involved in politics with no previous contact with world events.,5.9,1044,,,,,15,1
tt0421116,Alpha Male,Alpha Male,2006,2006-08-11,Drama,100,"USA, UK",English,Dan Wilde,Dan Wilde,Mobius International,"Jennifer Ehle, Patrick Baladi, Amelia Warner, Arthur Duncan, Katie Ann Knight, Danny Huston, Ewan Stewart, Trudie Styler, Mark Wells, Jemma Powell, Ellis Hollins, Eugene Simon, Mark Heap, Stirling Gallacher, Christopher Egan","Alpha Male is the story of family life. It is a film about the force of personality, family politics, repressed emotions, great love and devastating loss.",5.5,317,"$3,000,000",,"$33,699",,3,5
tt0472156,Plutonio 239 - Pericolo invisibile,The Half Life of Timofey Berezin,2006,2006-09-12,Drama,97,"USA, UK",English,Scott Z. Burns,"Scott Z. Burns, Ken Kalfus",HBO Films,"Paddy Considine, Oscar Isaac, Valeriu Pavel Dan, Kenneth Bryans, Radha Mitchell, Danya Baryshnikov, Connor McIntyre, Derek Hutchinson, Jason Flemyng, Jordan Long, Xenia Alina Grigore, Mélanie Thierry, Constantin Barbulescu, Oana Cojocaru, Stefan Iancu","A worker at a Russian nuclear facility gets exposed to a lethal dose of radiation. In order to provide for his family, he steals some plutonium and sets out to sell it on Moscow's black market with the help of an incompetent criminal.",6.9,3531,"$5,000,000",,,,32,13
tt1185344,Princess Ka'iulani,Princess Ka'iulani,2009,2010-05-14,Drama,130,"USA, UK","English, Hawaiian",Marc Forby,"Marc Forby, Robert Payne",Matador Pictures,"Q'orianka Kilcher, Barry Pepper, Shaun Evans, Jimmy Yuill, Will Patton, Leo Anderson Akana, Ocean Kaowili, Kamuela Kalilikane, Kimo Kalilikane, Esmond Chung, Reupena Paopao Sheck, Keith Barry, Brian Hayes Currie, Ka'alaka'iopono Faurot, Chandler Gines",The true story of a Hawaiian princess' attempts to maintain the independence of the island against the threat of American colonization.,6.2,1546,"$9,000,000","$883,887","$883,887",41,17,25
tt1423593,The Imperialists Are Still Alive!,The Imperialists Are Still Alive!,2010,2010,Drama,90,"USA, UK",English,Zeina Durra,Zeina Durra,Corniche Pictures,"Élodie Bouchez, José María de Tavira, Karim Saleh, Karolina Muller, Marianna Kulukundis, Rita Ackerman, Pierluca Arancio, Ahd, Sumy Ahn, Victoria Aitken, Ted Arcidi, Neville Aurelius, Sophie Auster, Sebastian Beacon, Judson Blane","Juggling the sudden abduction of her childhood sweetheart as well as a blooming love affair, a French Manhattanite makes her way as an artist in an indifferent, sometimes hostile world.",6,207,,"$5,874","$5,874",63,8,16
tt2035630,Starlet,Starlet,2012,2013-05-09,Drama,103,"USA, UK",English,Sean Baker,"Sean Baker, Chris Bergoch",Maybach Film Productions,"Dree Hemingway, Boonee, Stella Maeve, Sheri Vecchio, Robert Malmuth, Justin Boyd, Tracy Correll, Leo Garcia, Hayat Jubrail, Besedka Johnson, Jimena Alegre, Romina Gilmore, Peter Rutledge, James Ransone, Zoe Voss",An unlikely friendship forms between twenty-one-year-old Jane and the elderly Sadie after Jane discovers a hidden stash of money inside an object at Sadie's yard sale.,6.8,6742,,"$88,212","$146,222",74,27,81
tt3060492,Before I Disappear,Before I Disappear,2014,2014-11-28,Drama,93,"USA, UK",English,Shawn Christensen,Shawn Christensen,Fuzzy Logic Pictures,"Shawn Christensen, Fatima Ptacek, Emmy Rossum, Paul Wesley, Ron Perlman, Richard Schiff, Fran Kranz, Hani Avital, Isabelle McNally, Sean Ringgold, Joseph DeVito, Michael Drayer, Stephanie Kurtzuba, Joe Perrino, James Andrew O'Connor","At the lowest point of his life, Richie gets a call from his estranged sister, asking him to look after his eleven-year old niece, Sophia, for a few hours.",7.2,9034,,"$10,078","$10,078",47,26,42
tt3743272,The Doo Dah Man,The Doo Dah Man,2015,2017-04-24,Drama,92,"USA, UK",English,Claude Green,"Jack Ballo, Claude Green",Flatiron Pictures,"Glenn Morshower, Will Brittain, Katherine Willis, Holt Boggs, Tanner Beard, David Blackwell, Brenda Isaacs Booth, Kenneth Wayne Bradley, Jim Brewer, Lucky Cantu, Roger Chan, Russell Quinn Cummings, Sonny Carl Davis, Adam Dietrich, Larry Jack Dotson",Two lives intersect when a conman running from the police and a college boy running from his past meet on the lonely highways of America's southwest.,6.3,117,,,,,28,1
tt6257174,La diseducazione di Cameron Post,The Miseducation of Cameron Post,2018,2018-10-31,Drama,91,"USA, UK",English,Desiree Akhavan,"Desiree Akhavan, Cecilia Frugiuele",Beachside Films,"Chloë Grace Moretz, Steven Hauck, Quinn Shephard, Kerry Butler, Dalton Harrod, McCabe Slye, Dale Soules, Sasha Lane, John Gallagher Jr., Emily Skeggs, Marin Ireland, Forrest Goodluck, Melanie Ehrlich, Owen Campbell, Christopher Dylan White","In 1993, a teenage girl is forced into a gay conversion therapy center by her conservative guardians.",6.6,17874,,"$904,703","$1,474,577",69,94,144
tt7428884,Breaker,Breaker,2019,2019-07-05,Drama,85,"USA, UK",English,Wade F. Jackson,Wade F. Jackson,Manor House Films,"Chantz Marcus, Peter O'Brien, Alice Barrett, Jonathan Gaietto, Eddie Baacus, William Bloomfield, Morgan Fay, Richard Brevard, Mike Fitz, Rachel Anne Wilson, Matt Wilson, Kahadje Damewood, David Lackey, Dan Damewood, Scott Arnold",A troubled young veteran returns to his rural home and forms a friendship with a hermit rancher who offers sanctuary from his dysfunctional family.,4.9,142,,,,,8,1
tt8717446,Blackbird,Blackbird,2019,2020-09-18,Drama,97,"USA, UK",English,Roger Michell,Christian Torpe,Busted Shark Productions,"Kate Winslet, Sam Neill, Mia Wasikowska, Rainn Wilson, Susan Sarandon, Bex Taylor-Klaus, Lindsay Duncan, Anson Boon",A terminally ill mother arranges to bring her family together one last time before she dies. A remake of the 2014 Danish film 'Silent Heart'.,6.8,187,,,,55,,17
tt7985692,Dopo il matrimonio,After the Wedding,2019,2019-11-01,Drama,112,"USA, UK","English, Hindi",Bart Freundlich,"Bart Freundlich, Susanne Bier",Sony Pictures Classics,"Julianne Moore, Michelle Williams, Billy Crudup, Abby Quinn, Alex Esola, Susan Blackwell, Will Chase, Eisa Davis, Azhy Robertson, Tre Ryder, Vir Pachisia, Anjula Bedi, Kaizad Gandhi, Greta Quispe, Alex Cranmer",A manager of an orphanage in Kolkata travels to New York to meet a benefactor.,6.3,4977,,"$1,574,258","$2,790,019",50,85,90
tt0210357,The Testimony of Taliesin Jones,The Testimony of Taliesin Jones,2000,2000-10-12,"Drama, Family",93,"USA, UK",English,Martin Duffy,"Rhidian Brook, Maureen Tilyou",CF1 Cyf,"John-Paul Macleod, Jonathan Pryce, Geraldine James, Matthew Rhys, Robert Pugh, Sophie Sherrington, Mark Bishop, Griff Rhys Jones, Rhys Tucker, Ian Bannen, Anwen Williams, Morgan Hopkins, Gwenllian Davies, Philip Dunbar, Boyd Clack","A lonely boy, from a broken family, becomes inspired by faith healers.",6.1,239,,"$75,717",,,2,6
tt1661199,Cenerentola,Cinderella,2015,2015-03-12,"Drama, Family, Fantasy",105,"USA, UK",English,Kenneth Branagh,"Chris Weitz, Charles Perrault",Allison Shearmur Productions,"Cate Blanchett, Lily James, Richard Madden, Helena Bonham Carter, Nonso Anozie, Stellan Skarsgård, Sophie McShera, Holliday Grainger, Derek Jacobi, Ben Chaplin, Hayley Atwell, Rob Brydon, Jana Pérez, Alex Macqueen, Tom Edden","When her father unexpectedly dies, young Ella finds herself at the mercy of her cruel stepmother and her scheming stepsisters. Never one to give up hope, Ella's fortunes begin to change after meeting a dashing stranger.",6.9,155645,"$95,000,000","$201,151,353","$542,351,353",67,448,374
tt0445922,Across the Universe,Across the Universe,2007,2007-11-23,"Drama, Fantasy, History",133,"USA, UK",English,Julie Taymor,"Dick Clement, Ian La Frenais",Revolution Studios,"Evan Rachel Wood, Jim Sturgess, Joe Anderson, Dana Fuchs, Martin Luther, T.V. Carpio, Spencer Liff, Lisa Dwyer Hogg, Nicholas Lumley, Michael Ryan, Angela Mounsey, Erin Elliott, Robert Clohessy, Christopher Tierney, Curtis Holbrook",The music of,7.3,105047,"$45,000,000","$24,602,291","$29,625,761",56,550,170
tt0265086,Black Hawk Down - Black Hawk abbattuto,Black Hawk Down,2001,2002-02-08,"Drama, History, War",144,"USA, UK","English, Somali, Arabic",Ridley Scott,"Mark Bowden, Ken Nolan",Revolution Studios,"Josh Hartnett, Ewan McGregor, Tom Sizemore, Eric Bana, William Fichtner, Ewen Bremner, Sam Shepard, Gabriel Casseus, Kim Coates, Hugh Dancy, Ron Eldard, Ioan Gruffudd, Tom Guiry, Charlie Hofheimer, Danny Hoch",160 elite U.S. soldiers drop into Somalia to capture two top lieutenants of a renegade warlord and find themselves in a desperate battle with a large force of heavily-armed Somalis.,7.7,358188,"$92,000,000","$108,638,745","$172,989,651",74,1154,219
tt0408236,Sweeney Todd - Il diabolico barbiere di Fleet Street,Sweeney Todd: The Demon Barber of Fleet Street,2007,2008-02-22,"Drama, Horror, Musical",116,"USA, UK","English, Italian",Tim Burton,"John Logan, Hugh Wheeler",DreamWorks,"Johnny Depp, Helena Bonham Carter, Alan Rickman, Timothy Spall, Sacha Baron Cohen, Jamie Campbell Bower, Laura Michelle Kelly, Jayne Wisener, Ed Sanders, Gracie May Weldon, Ava May, Gabriella Freeman, Jody Halse, Aron Paramor, Lee Whitlock","The infamous story of Benjamin Barker, aka Sweeney Todd, who sets up a barber shop in London which is the basis for a sinister partnership with his fellow tenant, Mrs. Lovett.",7.3,337635,"$50,000,000","$52,898,073","$153,383,627",83,841,383
tt5913798,Wounds,Wounds,2019,2019-10-18,"Drama, Horror, Mystery",95,"USA, UK",English,Babak Anvari,"Babak Anvari, Nathan Ballingrud",Annapurna Pictures,"Armie Hammer, Zazie Beetz, Karl Glusman, Christin Rankins, Brad William Henke, Ben Sanders, Alexander Biglane, Matthew Underwood, Luke Hawx, Dakota Johnson, Kerry Cahill, Ritchie Montgomery, Terence Rosemore, Jim Klock, Martin Bats Bradford",Disturbing and mysterious things begin to happen to a bartender in New Orleans after he picks up a phone left behind at his bar.,4,14578,,,,51,511,71
tt8201852,You Should Have Left,You Should Have Left,2020,2020-06-18,"Drama, Horror, Mystery",93,"USA, UK",English,David Koepp,"David Koepp, Daniel Kehlmann",Blumhouse Productions,"Kevin Bacon, Amanda Seyfried, Avery Tiiu Essex, Colin Blumenau, Lowri Ann Richards, Joshua C Jackson, Eli Powers","A former banker, his actress wife, and their spirited daughter book a vacation at an isolated modern home in the Welsh countryside where nothing is quite as it seems.",5.3,9695,,,,46,251,88
tt0117002,Mary Reilly,Mary Reilly,1996,1996-03-22,"Drama, Horror, Romance",108,"USA, UK",English,Stephen Frears,"Valerie Martin, Christopher Hampton",NFH Productions,"Julia Roberts, John Malkovich, George Cole, Michael Gambon, Kathy Staff, Glenn Close, Michael Sheen, Bronagh Gallagher, Linda Bassett, Henry Goodman, Ciarán Hinds, Sasha Hanau, Moya Brady, Emma Griffiths Malin, David Ross","A housemaid falls in love with Dr. Henry Jekyll and his darkly mysterious counterpart, Mr. Edward Hyde.",5.8,13852,"$47,000,000","$5,707,094","$12,379,402",44,97,53
tt0486051,Wind Chill - Ghiaccio rosso sangue,Wind Chill,2007,2007-08-03,"Drama, Horror, Thriller",91,"USA, UK",English,Gregory Jacobs,"Joe Gangemi, Steven Katz",Blueprint Pictures,"Emily Blunt, Ashton Holmes, Martin Donovan, Ned Bellamy, Ian A. Wallace, Donny Lucas, Chelan Simmons, Darren Moore, Linden Banks, Caz Odin Darko, Heath Horejda","Two college students share a ride home for the holidays, but when they break down on a deserted stretch of road, they are preyed upon by the ghosts of people who have died there.",5.8,21495,"$6,000,000","$36,804","$285,060",52,141,91
tt1831806,The Thompsons,The Thompsons,2012,2012-11-07,"Drama, Horror, Thriller",82,"USA, UK",English,"Mitchell Altieri, Phil Flores","Mitchell Altieri, Phil Flores",Film Harvest,"Cory Knauf, Samuel Child, Mackenzie Firgens, Joseph McKelheer, Ryan Hartwig, Elizabeth Henstridge, Daniel O'Meara, Selina Giles, Sean Browne, Tom Holloway, Sean Cronin, James Lowe, Tammy Minoff, Craig Gellis, Sean Guse","On the run with the law on their trail, America's most anguished vampire family heads to England to find an ancient vampire clan. What they find instead could tear their family, and their throats, apart forever.",4.7,2165,"$3,000,000",,,,13,43
tt2494362,Bone Tomahawk,Bone Tomahawk,2015,2016-02-19,"Drama, Horror, Western",132,"USA, UK",English,S. Craig Zahler,S. Craig Zahler,Caliber Media Company,"Kurt Russell, Patrick Wilson, Matthew Fox, Richard Jenkins, Lili Simmons, Evan Jonigkeit, David Arquette, Fred Melamed, Sid Haig, Maestro Harrell, James Tolkan, Kathryn Morris, Zahn McClarnon, Michael Emery, Jeremy Tardy","In the dying days of the old west, an elderly sheriff and his posse set out to rescue their town's doctor from cannibalistic cave dwellers.",7.1,82432,"$1,800,000",,"$382,579",72,436,291
