imdb_title_id,title,original_title,year,date_published,genre,duration,country,language,director,writer,production_company,actors,description,avg_vote,votes,budget,usa_gross_income,worlwide_gross_income,metascore,reviews_from_users,reviews_from_critics
tt0443272,Lincoln,Lincoln,2012,2013-01-24,"Biography, Drama, History",150,"USA, India",English,Steven Spielberg,"Tony Kushner, Doris Kearns Goodwin",DreamWorks,"Daniel Day-Lewis, Sally Field, David Strathairn, Joseph Gordon-Levitt, James Spader, Hal Holbrook, Tommy Lee Jones, John Hawkes, Jackie Earle Haley, Bruce McGill, Tim Blake Nelson, Joseph Cross, Jared Harris, Lee Pace, Peter McRobbie","As the American Civil War continues to rage, America's president struggles with continuing carnage on the battlefield as he fights with many inside his own cabinet on the decision to emancipate the slaves.",7.3,240462,"$65,000,000","$182,207,973","$275,293,450",86,797,564
tt2776878,Thank You for Your Service,Thank You for Your Service,2017,2017-10-27,"Biography, Drama, War",109,"USA, India",English,Jason Hall,"David Finkel, Jason Hall",DreamWorks,"Miles Teller, Beulah Koale, Joe Cole, Scott Haze, Haley Bennett, Amy Schumer, Omar J. Dorsey, Keisha Castle-Hughes, Brad Beyer, Kerry Cahill, Stella Pileggi, David Morse, Adam Schumann, Tony Winters, Han Soto","A group of U.S. soldiers returning from Iraq struggle to integrate back into family and civilian life, while living with the memory of a war that threatens to destroy them long after they've left the battlefield.",6.5,11750,"$20,000,000","$9,536,300","$9,995,692",68,66,82
tt1704680,A Decent Arrangement,A Decent Arrangement,2011,2014-11-07,"Comedy, Drama",96,"USA, India",English,Sarovar Banka,Sarovar Banka,Secret Pact Productions,"Shabana Azmi, Diksha Basu, Adhir Bhat, Adam Laupus, Lethia Nall, Shriya Sharma","A Decent Arrangement is the story of Ashok Khosla, an Indian-American copywriter, who travels to India for an arranged marriage. After he encounters an American woman traveling through ...",5.7,223,,,,,4,1
tt4157510,For Here or to Go?,For Here or to Go?,2015,2017-03-31,"Comedy, Drama",105,"USA, India",English,Rucha Humnabadkar,Rishi Bhilawadikar,Many Cups of Chai Films,"Ali Fazal, Melanie Chandra, Rajit Kapur, Amitosh Nagpal, Omi Vaidya, Samrat Chakrabarti, Keith Stevenson, Apo W. Bazidi, Damien Chen, Alan Coyne, Amol Deshmane, Sheila Dobee, Gaurav Dwivedi, Christina Enneking, Bekka Fink",An aspiring Indian tech entrepreneur in the Silicon Valley finds himself unexpectedly battling the bizarre American immigration system to keep his dream alive or prepare to return home forever.,6.7,478,,,,56,13,3
tt3038542,Tie the Knot,Tie the Knot,2016,2017-02-21,"Comedy, Drama, Family",90,"USA, India",English,Shuja Paul,"Shuja Paul, Shuja Paul",Starlight Global Films,"Tara Reid, Karishma Ahluwalia, Parvesh Cheena, Omi Vaidya, Kavi Raz, Mona Sishodia, Sewell Whitney, Iyad Hajjaj, Fahad Olayan, Cesar Cipriano, Pritesh Shah, Pramode Kumar, Sahil Shroff, Nikhil Pai, Dean Schaller",The hysterical cross cultural journey of hearts.,3.5,137,"$800,000",,,,6,
tt0203289,American Desi,American Desi,2001,2002-09-27,"Comedy, Drama, Romance",100,"USA, India",English,Piyush Dinker Pandya,Piyush Dinker Pandya,American Desi Productions,"Deep Katdare, Purva Bedi, Ronobir Lahiri, Rizwan Manji, Kal Penn, Anil Kumar, Sunita Param, Aladdin Ullah, Eric Axen, Sanjit De Silva, Sunil Malhotra, Ami Shukla, Krishen Mehta, Smita Patel, Bina Sharif","College freshman Krishna Reddy, who has never cared for his Indian-American cultural heritage, looks forward to a new life on campus but is surprised to find that he has been assigned ...",6.6,1574,"$250,000","$907,835","$1,104,408",50,39,9
tt0397551,Se scappi ti trovo,My Bollywood Bride,2006,2007-03-22,"Comedy, Drama, Romance",95,"USA, India","English, Hindi",Rajeev Virani,"Brad Listermann, Richard Martini",Dream Team Films,"Jason Lewis, Kashmira Shah, Gulshan Grover, Sanjay Suri, Neha Dubey, Ash Chandler, Deepak Qazir, Madhuri Bhatia, Sean O'Brien Teague, Ssunny Suraani, Vineet Wadhwa","My Bollywood Bride tells the story of Alex, a copy-writer dreaming of being an adventure novelist someday, who meets and romances Indian beauty Reena, while she is vacationing in California...",4.7,606,"$2,000,000",,"$29,655",,14,9
tt0770772,Manuale d'infedeltà per uomini sposati,I Think I Love My Wife,2007,2007-08-17,"Comedy, Drama, Romance",94,"USA, India",English,Chris Rock,"Chris Rock, Louis C.K.",Fox Searchlight Pictures,"Chris Rock, Kerry Washington, Gina Torres, Steve Buscemi, Edward Herrmann, Welker White, Samantha Ivers, Michael Kenneth Williams, Cassandra Freeman, Stephen A. Smith, Wendell Pierce, Milan Howard, Roz Ryan, Christina Vidal, Eliza Coupe",A married man who daydreams about being with other women finds his will and morals tested after he's visited by the ex-mistress of his old friend.,5.5,16316,"$11,000,000","$12,550,605","$13,369,768",49,60,99
tt0329354,Marigold,Marigold,2007,2007-08-17,"Comedy, Romance",110,"USA, India",English,Willard Carroll,Willard Carroll,Hyperion Pictures,"Salman Khan, Ali Larter, Nandana Sen, Ian Bohen, Shari Watson, Helen, Vikas Bhalla, Suchitra Pillai, Vijayendra Ghatge, Roopak Saluja, Kiran Juneja, Gulshan Grover, Rakesh Bedi, Catherine Fulop, Marc Allen Lewis",Ali Larter plays an American actress who becomes immersed in the Bollywood film world.,4.8,1803,,,"$953,308",,28,17
tt3631112,La ragazza del treno,The Girl on the Train,2016,2016-11-03,"Crime, Drama, Mystery",112,"USA, India","English, Spanish",Tate Taylor,"Erin Cressida Wilson, Paula Hawkins",Amblin Partners,"Emily Blunt, Haley Bennett, Rebecca Ferguson, Justin Theroux, Luke Evans, Edgar Ramírez, Laura Prepon, Allison Janney, Darren Goldstein, Lisa Kudrow, Cleta Elaine Ellington, Lana Young, Rachel Christopher, Fernando Medina, Gregory Morley",A divorcee becomes entangled in a missing persons investigation that promises to send shockwaves throughout her life.,6.5,164886,"$45,000,000","$75,395,035","$173,185,859",48,488,371
tt2049630,Unfreedom,Unfreedom,2014,2015-05-29,"Crime, Drama, Romance",102,"USA, India","English, Hindi",Raj Amit Kumar,"Damon J. Taylor, Raj Amit Kumar",69 Productions,"Victor Banerjee, Adil Hussain, Bhanu Uday, Preeti Gupta, Bhavani Lee, Ankur Vikal, Seema Rahmani, Samrat Chakrabarti, Danae Nason, Andrew Platner, Kuldeep Sareen, Danny Boushebel, Alyy Khan, Dilip Shankar, Shayan Munshi",A lesbian daughter fights off an arranged marriage in India while a religious fundamentalist targets an anti-extremist scholar in New York.,5.1,1839,"$1,500,000","$3,778","$3,778",24,14,8
tt2965446,The Black Tape,The Black Tape,2014,2015-11-13,"Crime, Horror, Mystery",92,"USA, India",English,Ramone Menon,"Ramone Menon, Ramone Menon",Master Production and Location Services,"Elina Madison, Allen Marsh, Oto Brezina, Melanie Thompson, Parker Coppins, Viktoria Stonebrooke, Bryan Mordechai Jackson, Cassi Ellis, Douglas Olsson, Glen Ratcliffe",An intruder breaks into the home of an unsuspecting family in order to make a home made murder film.,5.6,103,"$55,000",,,,,4
tt0433416,Il destino nel nome - The Namesake,The Namesake,2006,2007-06-01,Drama,122,"USA, India","English, Hindi, Bengali, French",Mira Nair,"Sooni Taraporevala, Jhumpa Lahiri",Fox Searchlight Pictures,"Kal Penn, Tabu, Irrfan Khan, Jacinda Barrett, Zuleikha Robinson, Brooke Smith, Sahira Nair, Jagannath Guha, Ruma Guha Thakurta, Sandip Deb, Sukanya, Tanushree Shankar, Sabyasachi Chakrabarty, Tamal Ray Chowdhury, Dhruv Mookerji","American-born Gogol, the son of Indian immigrants, wants to fit in among his fellow New Yorkers, despite his family's unwillingness to let go of their traditional ways.",7.5,19079,"$9,500,000","$13,569,248","$20,354,321",82,126,163
tt2409634,This Is Our Time,This Is Our Time,2013,2013-03-01,Drama,104,"USA, India",English,Lisa Arnold,"Lisa Arnold, Lisa Arnold",Check the Gate Productions,"Shawn-Caulin Young, Kate Cobb, T.J. Dalrymple, Matthew Florida, Erin Bethea, Bruce Marchiano, Eric Roberts, Emily Sandifer, Nazar Khan, S. Mohana Priyan, Dawn Wells, Deepjyoti Naik, Erik Estrada, Kenneth C. Ulmer, Abigail Duhon","After graduation, five friends set out to make a difference in the world for God. Their ambitions are high, their passions are strong but will they have the courage to fulfill their calling...",5.5,414,"$350,000",,,,2,1
tt1411956,Sold,Sold,2014,2014-03-07,Drama,94,"USA, India","English, Hindi",Jeffrey D. Brown,"Jeffrey D. Brown, Joseph Kwong",Jaya International,"Gillian Anderson, David Arquette, Priyanka Bose, Tillotama Shome, Parambrata Chattopadhyay, Neerja Naik, Seema Biswas, Ankur Vikal, Sushmita Mukherjee, Eshika Dey, Ratnabali Bhattacharjee, Gopi Desai, Tanaji Dasgupta, Paran Bawa, Vikram Chatwal",A girl risks everything for freedom after being trafficked from her mountain village in Nepal to a brothel in India.,6.8,1483,,"$57,527","$57,527",49,18,7
tt0433425,Parzania,Parzania,2005,2007-01-26,"Drama, History",116,"USA, India","English, Hindi, Gujarati",Rahul Dholakia,"Rahul Dholakia, David N. Donihue",Circles Motion Pictures,"Naseeruddin Shah, Corin Nemec, Sarika, Parzaan Dastur, Sheeba Chaddha, Pear Barsiwala, Asif Basra, Raj Zutshi, Pushpendra Saini, Ram Gopal Bajaj, Rakesh Chaturvedi Om, Anupam Shyam","A parsi family struggles to find thier son in a genocide carried out by vested interests outfits during 2002, commonly known as Gujarat riots which broke out after the Godhra Train Burning incident. During riots more than 790 Muslim and 289 Hindus died and around 300 people missing in the Indian state of Gujarat.",7.6,1339,"$700,000",,"$279,872",,22,7
tt0949731,E venne il giorno,The Happening,2008,2008-06-12,"Drama, Mystery, Sci-Fi",91,"USA, India","English, French",M. Night Shyamalan,M. Night Shyamalan,Twentieth Century Fox,"Mark Wahlberg, Zooey Deschanel, John Leguizamo, Ashlyn Sanchez, Betty Buckley, Spencer Breslin, Robert Bailey Jr., Frank Collison, Jeremy Strong, Alan Ruck, Victoria Clark, M. Night Shyamalan, Alison Folland, Kristen Connolly, Cornell Womack","A science teacher, his wife, and a young girl struggle to survive a plague that causes those infected to commit suicide.",5,193156,"$48,000,000","$64,506,874","$163,403,799",34,1399,346
tt0169122,Kama Sutra - Il giardino profumato,Perfumed Garden: Tales of the Kama Sutra,2000,2000-06-03,"Drama, Romance",95,"USA, India",English,Jag Mundhra,"Randor Guy, Randor Guy",Angeles Entertainment,"Ivan Baccarat, Amy Lindsay, Pravesh Kumar, Gigi St. Blaque, Rajeshwari Sachdev, Nassar, Dhritiman Chatterjee, Kim Sill, Chris Thomas, Rajiv Chandrasekhar, Kip King, Bhupinder Singh, Jan Fawcett, Hal Long, Apollo","Imagine a world of pleasure, where passion is the ultimate obsession. When Michael and Lisa travel to India to restore an erotic sculpture, they are immediately acquainted with the Kama ...",3.3,395,,,,,9,2
tt0282883,Quicksand,Quicksand,2002,2002-03-15,"Drama, Thriller",92,"USA, India",English,Sam Firstenberg,"Steve Schoenberg, Ruben Gordon",Quantum Entertainment,"Michael Dudikoff, Brooke Theiss, Douglas Weston, Richard Kind, Dan Hedaya, Michael O'Hagan, Pamela Salem, Marisa Johnston, Sameer Dharmadhikari, Asif Basra, Lalith Sharma","Randi Stewart is a sergeant on a marine base where her father is the commanding officer. She is being treated by the new base psychiatrist, Bill Turner. Her brother, Gordon Stewart is ...",4.4,202,"$3,500,000",,,,4,5
tt3774866,Autumn Lights,Autumn Lights,2016,2017-04-01,"Drama, Mystery",98,"USA, Iceland, France","English, Italian, Icelandic",Angad Aulakh,Angad Aulakh,Last Carnival,"Guy Kent, Marta Gastini, Sveinn Ólafur Gunnarsson, Thora Bjorg Helga, Salóme Gunnarsdóttir, Stefán Hallur Stefánsson, Snorri Engilbertsson, Kolbeinn Arnbjörnsson, Sveinn Geirsson, Lilja Birgisdottir, Jordan Goldnadel, Charlotte Vercoustre",An American photographer adrift in a remote Icelandic community becomes entangled in the lives of a mysterious European couple.,6.5,1933,,"$197,000",,37,18,8
tt1527821,Heart String Marionette,Heart String Marionette,2012,2012-06-15,"Animation, Action",122,"USA, Iceland",English,M. dot Strange,M. dot Strange,Str8nime,"JP Anderson, Asil Aceves, Jimmy Urine, Richard Grove, Peter Adams, Elisabet De Saint Amour, Tanja Björk, Steinn Örvar Björnsson, Betany Coffland, Josh Garrett, Helyna Goya, Peter Mohamed, Rakel Musicbox, Edgar Nielsen, Scott E. Piteck","A tale about a kid, a samurai mime, and a stripper who all try to defeat a warlord and an evil clown who have successfully turned a countryside into a never ending nightmare filled with horrible monsters.",6,165,"$20,000",,,,11,2
tt0248190,No Such Thing,No Such Thing,2001,2002-11-15,"Comedy, Drama, Fantasy",102,"USA, Iceland","English, Icelandic",Hal Hartley,Hal Hartley,American Zoetrope,"Margrét Ákadóttir, Julie Anderson, Anna Kristín Arngrímsdóttir, Ilene Bergelson, Guðrún María Bjarnadóttir, Bessi Bjarnason, Helgi Björnsson, Robert John Burke, Julie Christie, Stacy Dawson, Maria Ellingsen, Anthony Giangrande, Erica Gimpel, Þröstur Leó Gunnarsson, Brynhildur Guðjónsdóttir",The story of a young journalist who journeys to Iceland to find her missing fiancé only to encounter a mythical creature. She eventually forges a relationship with the being.,6.1,3776,,"$62,703","$62,703",36,77,41
tt3722062,Bokeh,Bokeh,2017,2017-03-24,"Drama, Sci-Fi",92,"USA, Iceland",English,"Geoffrey Orthwein, Andrew Sullivan","Geoffrey Orthwein, Andrew Sullivan",Zealous Pictures,"Maika Monroe, Matt O'Leary, Arnar Jónsson, Gunnar Helgason, Berglind Rós Sigurðardóttir","On a romantic getaway to Iceland, a young American couple wake up one morning to discover every person on earth has disappeared. Their struggle to survive and to reconcile the mysterious ...",5,6999,,,,56,164,35
tt4565400,Child Eater,Child Eater,2016,2016-10-28,Horror,82,"USA, Iceland",English,Erlingur Thoroddsen,Erlingur Thoroddsen,Wheelhouse Creative,"Cait Bliss, Colin Critchley, Jason Martin, Dave Klasko, Brandon Smalls, James Wilcox, Melinda Chilton, Andrew Kaempfer, Kara Durrett, Weston Wilson, Charlotte Patton, Hilary R. Walker, Erika Russo, Owen Russo, Gabby Torres",A simple night of babysitting takes a horrifying turn when Helen realizes the boogeyman really is in little Lucas' closet.,4.3,853,,,"$4,422",,16,28
tt0454864,The Last Winter,The Last Winter,2006,2008-09-24,"Horror, Mystery, Thriller",101,"USA, Iceland",English,Larry Fessenden,"Larry Fessenden, Robert Leaver",Antidote Films (I),"Ron Perlman, James Le Gros, Connie Britton, Zach Gilford, Kevin Corrigan, Jamie Harrold, Pato Hoffmann, Joanne Shenandoah, Larry Fessenden, Oscar Miller, Hálfdán Theodórsson, Eggert Ketilsson, Jack Fessenden, John Speredakos, Halfdan Pedersen",The American oil company North Corporation is building an ice road to explore the remote Northern Arctic National Wildlife Refuge seeking oil. The independent environmentalists together ...,5.6,8505,"$5,000,000","$33,190","$97,522",69,97,95
tt0113538,Un ragazzo alla corte di re Artù,A Kid in King Arthur's Court,1995,1996-08-23,"Adventure, Comedy, Family",89,"USA, Hungary, UK",English,Michael Gottlieb,"Michael Part, Robert L. Levy",Tapestry Films,"Thomas Ian Nicholas, Joss Ackland, Art Malik, Paloma Baeza, Kate Winslet, Daniel Craig, David Tysall, Ron Moody, Barry Stanton, Michael Mehlmann, Melanie Oettinger, Rebecca Denton, Michael Kelly, Louise Rosner, Paul Rosner",A Little League player is sent back into medieval times where he is given the task of saving Camelot.,4.7,5640,"$15,000,000","$13,406,717","$13,406,717",34,20,11
tt3079222,The Man Who Was Thursday,The Man Who Was Thursday,2016,2017-09-14,"Mystery, Thriller",95,"USA, Hungary, Italy, Romania",English,Balazs Juszt,"G.K. Chesterton, Balazs Juszt",Cobera Capital Group,"Ana Ularu, Jordi Mollà, François Arnaud, Mark Ivanir, Emanuela Postacchini, Isabel García Lorca, Attila C. Arpa, Linc Hand, Theo Alexander, Ferenc Hujber, Péter Fancsikai, István Kovács, Krisztián Kolovratnik, László Konter, András Faragó","THE MAN WHO WAS THURSDAY is inspired by the existentialist novel of the same name by G.K. Chesterton (1908). The novel is considered a metaphysical thriller, and our film could be ...",4.8,250,,,,,3,24
tt1161864,Il rito,The Rite,2011,2011-03-11,"Drama, Horror, Mystery",114,"USA, Hungary, Italy","English, Welsh, Italian, Latin, Russian, Hungarian",Mikael Håfström,"Michael Petroni, Matt Baglio",New Line Cinema,"Anthony Hopkins, Colin O'Donoghue, Alice Braga, Ciarán Hinds, Toby Jones, Rutger Hauer, Marta Gastini, Maria Grazia Cucinotta, Arianna Veronesi, Andrea Calligari, Chris Marquette, Torrey DeVitto, Ben Cheetham, Marija Karan, Rosa Pianeta",American seminary student Michael Kovak (Colin O'Donaghue) travels to Italy to take an exorcism course.,6,89627,"$37,000,000","$33,047,633","$96,560,591",38,217,274
tt0297181,Le spie,I Spy,2002,2003-02-21,"Action, Adventure, Comedy",97,"USA, Hungary","English, Hungarian, Russian",Betty Thomas,"Morton S. Fine, David Friedkin",Columbia Pictures,"Eddie Murphy, Owen Wilson, Famke Janssen, Malcolm McDowell, Gary Cole, Phill Lewis, Viv Leacock, Keith Dallas, Tate Taylor, Lynda Boyd, Bill Mondy, Larry Merchant, Sugar Ray Leonard, Jimmy Lennon Jr., Joe Cortez",A professional athlete has to help a U.S. government agent recover a missing jet.,5.4,48535,"$70,000,000","$33,561,137","$51,386,477",35,150,111
tt3062096,Inferno,Inferno,2016,2016-10-13,"Action, Adventure, Crime",121,"USA, Hungary","English, French, Italian, Turkish",Ron Howard,"Dan Brown, David Koepp",Columbia Pictures,"Tom Hanks, Felicity Jones, Omar Sy, Irrfan Khan, Sidse Babett Knudsen, Ben Foster, Ana Ularu, Ida Darvish, Paolo Antonio Simioni, Alessandro Grimaldi, Fausto Maria Sciarappa, Robin Mugnaini, Paul Ritter, Vincenzo Tanassi, Alessandro Fabrizi","When Robert Langdon wakes up in an Italian hospital with amnesia, he teams up with Dr. Sienna Brooks, and together they must race across Europe against the clock to foil a deadly global plot.",6.2,153986,"$75,000,000","$34,343,574","$220,021,259",42,400,233
tt1267297,Hercules: Il guerriero,Hercules,2014,2014-08-13,"Action, Adventure, Fantasy",98,"USA, Hungary",English,Brett Ratner,"Ryan J. Condal, Evan Spiliotopoulos",Paramount Pictures,"Dwayne Johnson, Ian McShane, John Hurt, Rufus Sewell, Aksel Hennie, Ingrid Bolsø Berdal, Reece Ritchie, Joseph Fiennes, Tobias Santelmann, Peter Mullan, Rebecca Ferguson, Isaac Andrews, Joe Anderson, Stephen Peacocke, Nicholas Moss","Having endured his legendary twelve labors, Hercules, the Greek demigod, has his life as a sword-for-hire tested when the King of Thrace and his daughter seek his aid in defeating a tyrannical warlord.",6,143777,"$100,000,000","$72,688,614","$244,819,862",47,301,262
tt0257510,Crocodile 2: Death Swamp,Crocodile 2: Death Swamp,2002,2004-12-02,"Action, Adventure, Horror",89,"USA, Hungary",English,Gary Jones,"Jace Anderson, Boaz Davidson",Martien Holdings A.V.V.,"Heidi Lenhart, Chuck Walczak, Jon Sklaroff, Darryl Theirse, David Valcin, James Parks, Martin Kove, Steven Moreno, Billy Rieck, Anna Cranage, Dan Martin, Sean Euro, Suzanne Thirumur, Teea Laitinen, Lalith Sharma","A criminal carrying stolen money and gold hijacks a plane that crashes in a Mexican swamp, where the survivors are terrorized by a giant crocodile.",3.8,1784,"$2,200,000",,,,45,14
tt2106651,Spectral,Spectral,2016,2016-12-09,"Action, Adventure, Sci-Fi",107,"USA, Hungary","English, Russian, Romanian, Slovenian",Nic Mathieu,"Ian Fried, Nic Mathieu",Legendary Entertainment,"James Badge Dale, Emily Mortimer, Bruce Greenwood, Max Martini, Cory Hardrict, Clayne Crawford, Gonzalo Menendez, Ursula Parker, Aaron Serban, Stephen Root, Jimmy Akingbola, Tsogbaatar Batzorig, Mike Bodie, Philip Bulcock, Miklós Bányai",A sci-fi/thriller story centered on a special-ops team that is dispatched to fight supernatural beings.,6.3,50288,"$70,000,000",,,,246,48
tt0312609,Sotto massima copertura - Den of Lions,Den of Lions,2003,2005,"Action, Crime, Thriller",103,"USA, Hungary",English,James Bruce,"James Bruce, Freddy Deane",Millennium Films,"Stephen Dorff, Bob Hoskins, Laura Fraser, Ian Hart, David O'Hara, József Gyabronka, Andrew McCulloch, Tania Emery, Philip Madoc, Attila Szatmari, Sarah Ann Schultz, Zita Görög, Nabil Massad, Robert Willox, Athina Papadimitriu",A Hungarian gypsy working for a Russian mobster becomes a double agent for the FBI.,4.8,649,"$6,000,000",,,,7,11
tt0265104,La stirpe,The Breed,2001,2001-07-19,"Action, Horror, Sci-Fi",91,"USA, Hungary","English, German",Michael Oblowitz,"Christos N. Gage, Ruth Fletcher",Motion Picture Corporation of America (MPCA),"Adrian Paul, Bokeem Woodbine, Bai Ling, Péter Halász, James Booth, Ming Lo, Paul Collins, Debbie Javor, Reed Diamond, John Durbin, Zen Gesner, István Göz, William Hootkins, Brandy Miller, Donte Calarco","In the distant future vampires have come out of the shadows and tried to live among people as a special and peaceful breed. When a series of murders happens, a cop and his vampire colleague...",4.8,2554,"$4,000,000",,,,75,25
tt0107954,Return of the Roller Blade Seven,Return of the Roller Blade Seven,1993,1993,"Action, Sci-Fi",78,"USA, Hungary","English, Hungarian",Donald G. Jackson,"Donald G. Jackson, Scott Shaw",The Rebel Corp.,"Scott Shaw, Joe Estevez, Allison Coleman, Don Stroud, Karen Black, Frank Stallone, Selina Jayne, Rhonda Shear, William Smith, Greg O'Neill, Roger Ellis, Chanel Akiko Hirai, Ani Bilesky, Liselotte Christiansen, Jill Kelly","The further adventures of the lone samurai Hawk, as he continues his battle to defeat the evil Pharaoh, Saint Offender and the Black Knight. Guided by his Psychic, Hawk ultimate defeats his adversaries and brings order to the universe.",2.7,162,,,,,3,1
tt0146063,La principessa sul pisello,The Princess and the Pea,2002,2002-08-16,"Animation, Adventure, Family",75,"USA, Hungary",English,Mark Swan,"Forrest S. Baker III, Ken Cromar",Feature Films for Families,"Forrest S. Baker III, Sarah Baker, Hetty Baynes, Liz May Brice, Péter Bálint, Csaba Krisztián Csík, Ádám Czetõ, Balázs Dévai, Stan Ellsworth, András Faragó, Dan Finnerty, Jonathan Firth, Gábor Harsányi, Lincoln Hoppe, Ève Karpf","It is loosely based on Hans Christian Anderson's classic fairy tale. Because the evil prince Laird did not inherit the crown of Corazion, he sought his revenge by secretly switching his ...",6.3,260,,,"$195,358",,5,1
tt1193627,Immigrants (L.A. Dolce Vita),Immigrants (L.A. Dolce Vita),2008,2008-10-30,"Animation, Comedy",78,"USA, Hungary",English,Gabor Csupo,"Billiam Coronel, Josh Lieb",Grand Allure Entertainment,"Hank Azaria, Ahmed Ahmed, Jen Alexander, Jack Angel, Jeff Bennett, Jusak Bernhard, Titanilla Bogdányi, Tera Bonilla, András Both, Bret Csupo, Mark DeCarlo, Patti Deutsch, Neil Dickson, Péter Fehér, Fergie","Jóska, a Hungarian immigrant in Los Angeles is sharing an apartment with the Russian Vladislav. In their search for the ""American Dream"" they get into all kinds of troubles, wild adventures...",5.7,761,,,"$122,236",,,2
tt0339397,Mix,Mix,2004,2004-01-29,"Comedy, Drama",97,"USA, Hungary","English, Hungarian",Steven Lovy,"Robert Lovy, Robert Lovy",MixPix Productions,"Alex Weed, Jeffrey Schecter, János Kulka, Dorka Gryllus, Olga Koós, Krisztián Kolovratnik, Péter Rudolf, Eszter Csákányi, Ferenc Némethy, Anita Bogozi, Eszter Bíró, Tamás Deák, Adrienn Dubay, Andrew Hefler, Béla Jáki","A young Los Angeles club DJ, caught between the wishes of his overbearing father and his dreams of musical freedom, uncovers danger, music, a dark family secret and the girl of his dreams, ...",5.8,245,"$1,000,000",,"$47,401",,10,2
tt0375063,Sideways - In viaggio con Jack,Sideways,2004,2005-02-16,"Comedy, Drama, Romance",127,"USA, Hungary","English, Armenian",Alexander Payne,"Rex Pickett, Alexander Payne",Fox Searchlight Pictures,"Paul Giamatti, Thomas Haden Church, Virginia Madsen, Sandra Oh, Marylouise Burke, Jessica Hecht, Missy Doty, M.C. Gainey, Alysia Reiner, Shake Tukhmanyan, Shaun Duke, Robert Covarrubias, Patrick Gallagher, Stephanie Faracy, Joe Marinelli","Two men reaching middle age with not much to show but disappointment embark on a week-long road trip through California's wine country, just as one is about to take a trip down the aisle.",7.5,177052,"$16,000,000","$71,503,593","$109,706,931",94,881,295
tt4160708,Man in the Dark,Don't Breathe,2016,2016-09-08,"Crime, Horror, Thriller",88,"USA, Hungary",English,Fede Alvarez,"Fede Alvarez, Rodo Sayagues",Screen Gems,"Stephen Lang, Jane Levy, Dylan Minnette, Daniel Zovatto, Emma Bercovici, Franciska Töröcsik, Christian Zagia, Katia Bokor, Sergej Onopko, Olivia Gillies, Dayna Clark, Athos, Astor, Nomad","Hoping to walk away with a massive fortune, a trio of thieves break into the house of a blind man who isn't as helpless as he seems.",7.1,212761,"$9,900,000","$89,217,875","$157,830,487",71,651,411
tt0221799,In fuga per la libertà,An American Rhapsody,2001,2002-02-28,Drama,106,"USA, Hungary","English, Hungarian",Éva Gárdos,Éva Gárdos,Fireworks Pictures,"Scarlett Johansson, Nastassja Kinski, Raffaella Bánsági, Tony Goldwyn, Ágnes Bánfalvy, Zoltán Seress, Klaudia Szabó, Zsolt Zágoni, András Szöke, Erzsi Pásztor, Carlos Laszlo, Bori Kereszturi, Péter Kálloy Molnár, Zsuzsa Czinkóczi, Balázs Galkó",A young Hungarian girl struggles to find her place in the world when she's reunited with her parents in the USA years after she was left behind during their flight from the communist country in the 1950s.,6.7,3823,,"$850,255","$970,676",51,46,29
